{
  "schema_version": "1",
  "tool": {
    "name": "mailauthprobe",
    "version": "VERSION"
  },
  "kind": "message",
  "target": "testdata/messages/spf-loop.eml",
  "summary": {
    "highest_severity": "high",
    "counts": {
      "critical": 0,
      "high": 2,
      "info": 2,
      "low": 0,
      "medium": 1,
      "pass": 0
    },
    "dns_queries": 4
  },
  "message": {
    "size": 498,
    "header_size": 438,
    "body_available": true,
    "headers": {
      "from": [
        "Loop <a@loop.example>"
      ],
      "return_path": [
        "<bounce@loop.example>"
      ],
      "to": [
        "Bob <bob@receiver.example>"
      ],
      "subject": [
        "Loop"
      ],
      "message_id": [
        "<loop-1@loop.example>"
      ],
      "date": [
        "Mon, 14 Sep 2026 10:00:00 +0000"
      ],
      "mime_version": [
        "1.0"
      ],
      "content_type": [
        "text/plain; charset=utf-8"
      ]
    },
    "mime": {
      "content_type": "text/plain",
      "charset": "utf-8",
      "size": 60,
      "depth": 0
    },
    "received": {
      "hops": [
        {
          "index": 1,
          "raw": "from mail.loop.example (mail.loop.example [192.0.2.10])\tby mx.receiver.example (Postfix) with ESMTPS id CC9DAEBFC0\tfor <bob@receiver.example>; Mon, 14 Sep 2026 10:00:00 +0000",
          "from_host": {
            "value": "mail.loop.example",
            "source": "stated"
          },
          "helo": {
            "value": "mail.loop.example",
            "source": "inferred"
          },
          "reverse_dns": {
            "value": "mail.loop.example",
            "source": "inferred"
          },
          "ip": {
            "value": "192.0.2.10",
            "source": "stated"
          },
          "by": {
            "value": "mx.receiver.example",
            "source": "stated"
          },
          "protocol": "ESMTPS",
          "id": "CC9DAEBFC0",
          "for": "bob@receiver.example",
          "timestamp": "2026-09-14T10:00:00Z",
          "tls": {
            "used": true,
            "source": "inferred"
          }
        }
      ]
    },
    "spf": {
      "inputs": {
        "ip": {
          "value": "192.0.2.10",
          "source": "received",
          "inferred": true
        },
        "helo": {
          "value": "mail.loop.example",
          "source": "received",
          "inferred": true
        },
        "mail_from": {
          "value": "bounce@loop.example",
          "source": "return-path",
          "inferred": true
        }
      },
      "mail_from": {
        "result": "permerror",
        "reason": "include/redirect loop: loop.example -> a.loop.example -> loop.example",
        "domain": "loop.example",
        "dns_lookups": 2,
        "void_lookups": 0,
        "trace": [
          {
            "depth": 0,
            "domain": "loop.example",
            "note": "record: v=spf1 include:a.loop.example -all"
          },
          {
            "depth": 1,
            "domain": "a.loop.example",
            "note": "record: v=spf1 include:loop.example -all"
          },
          {
            "depth": 2,
            "domain": "loop.example",
            "note": "loop detected: loop.example -> a.loop.example -> loop.example"
          },
          {
            "depth": 1,
            "domain": "a.loop.example",
            "term": "include:loop.example",
            "note": "permerror: include/redirect loop: loop.example -> a.loop.example -> loop.example"
          },
          {
            "depth": 0,
            "domain": "loop.example",
            "term": "include:a.loop.example",
            "note": "permerror: include/redirect loop: loop.example -> a.loop.example -> loop.example"
          }
        ],
        "loop_detected": true
      },
      "helo": {
        "result": "none",
        "reason": "no SPF record published for mail.loop.example",
        "domain": "mail.loop.example",
        "dns_lookups": 0,
        "void_lookups": 0,
        "trace": [
          {
            "depth": 0,
            "domain": "mail.loop.example",
            "note": "no SPF record: none"
          }
        ]
      },
      "result": "permerror",
      "domain": "loop.example"
    },
    "dkim": [],
    "dmarc": {
      "result": "fail",
      "reason": "no authenticated identifier is aligned with loop.example",
      "from_domain": "loop.example",
      "discovery": {
        "domain": "loop.example",
        "organizational_domain": "loop.example",
        "policy_domain": "loop.example",
        "records": [
          "v=DMARC1; p=quarantine"
        ],
        "record": {
          "raw": "v=DMARC1; p=quarantine",
          "tags": [
            {
              "name": "v",
              "value": "DMARC1"
            },
            {
              "name": "p",
              "value": "quarantine"
            }
          ],
          "p": "quarantine",
          "pct": 100,
          "adkim": "r",
          "aspf": "r",
          "fo": [
            "0"
          ],
          "rf": "afrf",
          "ri": 86400
        }
      },
      "policy": "quarantine",
      "pct": 100,
      "disposition": "quarantine",
      "spf_aligned": false,
      "dkim_aligned": false,
      "adkim": "r",
      "aspf": "r"
    },
    "authentication_results": []
  },
  "findings": [
    {
      "id": "MAIL-DMARC-031",
      "severity": "high",
      "category": "security-weakness",
      "component": "dmarc",
      "title": "DMARC fail",
      "subject": "loop.example",
      "description": "DMARC fail for loop.example: neither SPF nor DKIM produced an aligned pass. The domain requests p=quarantine.",
      "evidence": [
        "header.from=loop.example",
        "policy_domain=loop.example",
        "p=quarantine sp=quarantine pct=100 adkim=r aspf=r",
        "spf=permerror domain=loop.example aligned=false"
      ],
      "recommendation": "The From domain could not be authenticated. Unless the message passed through a forwarder or mailing list that broke authentication, treat it as spoofed.",
      "references": [
        "https://www.rfc-editor.org/rfc/rfc7489#section-6.6.2"
      ]
    },
    {
      "id": "MAIL-SPF-034",
      "severity": "high",
      "category": "standard-violation",
      "component": "spf",
      "title": "SPF evaluation error",
      "subject": "loop.example",
      "description": "SPF for MAIL FROM loop.example from 192.0.2.10: permerror. include/redirect loop: loop.example -> a.loop.example -> loop.example.",
      "evidence": [
        "client-ip=192.0.2.10",
        "identity=mailfrom",
        "domain=loop.example"
      ],
      "recommendation": "SPF returned temperror or permerror; receivers may reject or ignore SPF for this domain. See the reason for details.",
      "references": [
        "https://www.rfc-editor.org/rfc/rfc7208#section-2.6.6",
        "https://www.rfc-editor.org/rfc/rfc7208#section-2.6.7"
      ]
    },
    {
      "id": "MAIL-DKIM-025",
      "severity": "medium",
      "category": "security-weakness",
      "component": "dkim",
      "title": "Message is not DKIM-signed",
      "description": "The message has no DKIM-Signature. Its content and From domain are not cryptographically authenticated.",
      "recommendation": "Without DKIM, DMARC can only pass through SPF, which breaks on forwarding.",
      "references": [
        "https://www.rfc-editor.org/rfc/rfc6376"
      ]
    },
    {
      "id": "MAIL-AR-005",
      "severity": "info",
      "category": "informational",
      "component": "authentication-results",
      "title": "No Authentication-Results headers",
      "description": "The message carries no Authentication-Results headers to compare with.",
      "references": [
        "https://www.rfc-editor.org/rfc/rfc8601"
      ]
    },
    {
      "id": "MAIL-SPF-035",
      "severity": "info",
      "category": "informational",
      "component": "spf",
      "title": "SPF inputs inferred from message headers",
      "description": "SPF inputs were reconstructed from message headers, which the sender can forge above the receiving organization's boundary. Confirm them with --source-ip, --helo and --mail-from from the receiving MTA's logs.",
      "evidence": [
        "HELO mail.loop.example (from received)",
        "MAIL FROM bounce@loop.example (from return-path)",
        "client IP 192.0.2.10 (from received)"
      ],
      "references": [
        "https://www.rfc-editor.org/rfc/rfc7208#section-9.1"
      ]
    }
  ],
  "errors": []
}
